{
  "id": "CVE-2026-109619",
  "title": "RCE via stale global state",
  "severity": "critical",
  "published": "2026-10-21",
  "summary": "PHP request-owned global or extension state can survive a request boundary after an interrupted operation and later be accessed by another request handled by the same worker. Under specific reachable conditions this use-after-free can lead to remote code execution. Consult the upstream advisory for detailed attack conditions and mitigations.",
  "affected": "PHP branches before the listed patched releases; vendor builds may carry backported fixes.",
  "fixed_by": {
    "8.2": "8.2.35",
    "8.3": "8.3.36",
    "8.4": "8.4.27",
    "8.5": "8.5.12"
  },
  "url": "https://github.com/php/php-src/security/advisories/GHSA-6wmf-4rv5-p3rp",
  "references": [
    "https://github.com/php/php-src/security/advisories/GHSA-6wmf-4rv5-p3rp",
    "https://www.php.net/archive/2026.php",
    "https://www.php.net/supported-versions.php"
  ],
  "weaknesses": [
    "CWE-416",
    "CWE-755",
    "CWE-824"
  ],
  "notes": "Version-based guidance only. The upstream advisory states that updating is the only reliable mitigation; verify distribution and hosting vendor backports."
}
