{
  "id": "CVE-2026-109618",
  "title": "PHP security vulnerability (see upstream advisory)",
  "severity": "critical",
  "published": "2026-10-21",
  "summary": "See the upstream PHP security advisory for affected components and technical details.",
  "fixed_by": {
    "8.2": "8.2.35",
    "8.3": "8.3.36",
    "8.4": "8.4.27",
    "8.5": "8.5.12"
  },
  "url": "https://github.com/php/php-src/security/advisories/GHSA-w8hw-w9fx-j79w",
  "references": [
    "https://github.com/php/php-src/security/advisories/GHSA-w8hw-w9fx-j79w",
    "https://www.php.net/archive/2026.php",
    "https://www.php.net/supported-versions.php"
  ],
  "notes": "Version-based guidance only. Verify distribution and hosting vendor backports."
}
