{
  "id": "CVE-2026-109619",
  "title": "Critical PHP security vulnerability",
  "severity": "critical",
  "published": "2026-10-21",
  "summary": "Consult the official PHP release announcement for the technical scope.",
  "fixed_by": {
    "8.2": "8.2.35",
    "8.3": "8.3.36",
    "8.4": "8.4.27",
    "8.5": "8.5.12"
  },
  "url": "https://www.php.net/archive/2026.php",
  "references": [
    "https://www.php.net/archive/2026.php",
    "https://www.php.net/supported-versions.php"
  ],
  "notes": "Version-based guidance only. Verify distribution and hosting vendor backports."
}
