{
  "id": "CVE-2026-109618",
  "title": "RCE via OOM corruption",
  "severity": "critical",
  "published": "2026-10-21",
  "summary": "PHP can leave request memory in an invalid state when an out-of-memory error interrupts early request processing. Request shutdown may then access invalid state, potentially enabling remote code execution. Consult the upstream advisory for detailed attack conditions and mitigations.",
  "affected": "PHP branches before the listed patched releases; vendor builds may carry backported fixes.",
  "fixed_by": {
    "8.2": "8.2.35",
    "8.3": "8.3.36",
    "8.4": "8.4.27",
    "8.5": "8.5.12"
  },
  "url": "https://github.com/php/php-src/security/advisories/GHSA-w8hw-w9fx-j79w",
  "references": [
    "https://github.com/php/php-src/security/advisories/GHSA-w8hw-w9fx-j79w",
    "https://www.php.net/archive/2026.php",
    "https://www.php.net/supported-versions.php"
  ],
  "weaknesses": [
    "CWE-416",
    "CWE-755",
    "CWE-824"
  ],
  "notes": "Version-based guidance only. The upstream advisory states that updating is the only complete mitigation; verify distribution and hosting vendor backports."
}
